Title,Description,Link,Media URL,Pinterest board,Publish Date
Discover Why 'Minari' is 2021’s Hidden Gem!,"Dive into 'Minari', an inspiring 2021 cinematic treasure that's not only a Movies to Watch list staple but a unique Film Recommendation for any film lover! While there's no overview available, imagine a poignant journey through family, dreams, and resilience. Unravel personal stories through the stunning Movie Poster and rich cinema narrative. Head over to Filmospere to explore more on why this film should captivate your heart!",https://filmospere.com/movie/minari-2021,https://image.tmdb.org/t/p/original/6mPNdmjdbVKPITv3LLCmQoKs9Zw.jpg,Best Movies to Watch,2026-02-01T00:30:00
Must Watch: The End of Evangelion – Anime's Deepest Mind-Bender,"Dive into an unforgettable cinematic experience with 'Neon Genesis Evangelion: The End of Evangelion'. This 1997 classic is a must on your 'Movies to Watch' list, captivating audiences with its complex narrative and stunning visuals. Discover why it's a top film recommendation for any anime and cinema enthusiast. Check out exclusive insights and the iconic movie poster on Filmospere. Join us, movie-lover to movie-lover, and explore the genius of this genre-defining masterpiece!",https://filmospere.com/movie/neon-genesis-evangelion-the-end-of-evangelion-1997,https://image.tmdb.org/t/p/original/j6G24dqI4WgUtChhWjfnI4lnmiK.jpg,Best Movies to Watch,2026-02-01T03:30:00
Unravel the Horror: 5 Reasons It Chapter Two Will Haunt You,"Dive into the spine-chilling universe of It Chapter Two, a must-watch for Cinema fans. Discover the thrilling continuation of Stephen King's horror saga that has captivated audiences. Looking for Movies to Watch? Let Filmospere guide you. Explore why this film has an impressive 6.8/10 rating and find out what makes it a top Film Recommendation. Check out the striking Movie Poster and join the discussion on Filmospere today!",https://filmospere.com/movie/it-chapter-two-2019,https://image.tmdb.org/t/p/original/zfE0R94v1E8cuKAerbskfD3VfUt.jpg,Best Movies to Watch,2026-02-01T11:30:00
Unlikely Road Trip Fun in 'We're the Millers' (2013) – A Comedy Adventure,"Looking for laughter-filled Movies to Watch? 'We're the Millers' (2013) delivers a hilarious Cinema experience with its unique plot of a fake family on a wild road trip, packed with mishaps and laughs. This Filmosphere recommendation shouldn't be missed by comedy lovers! Discover more fun Film Recommendations and check out the iconic Movie Poster, capturing the chaos in style. Dive into the world of comedy and explore a surprising journey with us at Filmospere!",https://filmospere.com/movie/we-re-the-millers-2013,https://image.tmdb.org/t/p/original/qF2LJ0jwWrtXSuT4AFD5OS2IqaT.jpg,Best Movies to Watch,2026-02-01T15:30:00
Why 'The Gold Rush' is a Timeless Cinema Classic,"Step into the silent film era with Charlie Chaplin's 'The Gold Rush', a 1925 gem every movie-lover should explore. Rated 8.0, this iconic piece of cinema stands as a testament to Chaplin's comedic brilliance and storytelling flair. If you're curating your Movies to Watch list or on a quest for inspiring Film Recommendations, this classic should top your list. Discover more about this timeless masterpiece on Filmospere. Don't forget to pin this Movie Poster to share the magic!",https://filmospere.com/movie/the-gold-rush-1925,https://image.tmdb.org/t/p/original/eQRFo1qwRREYwj47Yoe1PisgOle.jpg,Best Movies to Watch,2026-02-01T20:30:00