Title,Description,Link,Media URL,Pinterest board,Publish Date
Uncover the Mystery: Why 1974's Murder on the Orient Express Is a Must-Watch,"Embark on a thrilling journey with the classic 'Murder on the Orient Express'! A perfect blend of suspense and intrigue, this 1974 cinema masterpiece is a true gem for movie lovers. Looking for quality Movies to Watch or craving a gripping Film Recommendation? Dive into the mystery today! And don't miss the stunning Movie Poster. Head to Filmospere for more insights and let us fuel your movie adventures!",https://filmospere.com/movie/murder-on-the-orient-express-1974,https://image.tmdb.org/t/p/original/oJjKcuoH7SuiqZaEpHt2Nd5ZxNY.jpg,Best Movies to Watch,2026-02-17T00:30:00
Why 'Sweet Home' (2020) Deserves a Spot on Your Watchlist!,"Dive into the chilling and captivating world of 'Sweet Home'. With an impressive 8.3/10 rating, this 2020 gem is a cinema marvel you shouldn't miss. Looking for movies to watch? Here's a unique film recommendation that blends suspense and intrigue. Discover why 'Sweet Home' stands out in the Cinema genre. Check out the movie poster on Filmospere and explore more thrilling recommendations. Don’t miss this gripping journey into the unexpected!",https://filmospere.com/movie/sweet-home-2020,https://image.tmdb.org/t/p/original/ovLdkMclsr9NjkfRPgMaGDTHyGk.jpg,Best Movies to Watch,2026-02-17T03:30:00
Inside Out 2: Why This 2024 Emotional Journey is a Must-Watch!,"Get ready for another emotional rollercoaster with 'Inside Out 2'! This 2024 Cinema gem, rated 7.5/10, is perfect for your Movies to Watch list. Without giving too much away, prepare to experience a blend of laughter and tears. Dive inside the mind and explore new emotional adventures! Check the Movie Poster and add it to your Film Recommendation list. Discover more movie insights at Filmospere, the destination for every movie lover!",https://filmospere.com/movie/inside-out-2-2024,https://image.tmdb.org/t/p/original/vpnVM9B6NMmQpWeZvzLvDESb2QY.jpg,Best Movies to Watch,2026-02-17T11:30:00
Critically Flawed or Secretly Brilliant? Discover 2015's Fantastic Four!,"Looking for unique movies to watch? Dive into the extraordinary world of 2015's 'Fantastic Four'. Often overlooked, this cinema piece offers intriguing plot twists and unexpected storytelling. Unravel why it stands as a film recommendation worth considering. Check out the iconic movie poster and join in the discussion at Filmospere. Don't miss the chance to explore its underlying genius—discover what makes it a fantastic topic for movie-lovers everywhere!",https://filmospere.com/movie/fantastic-four-2015,https://image.tmdb.org/t/p/original/cDroz5qSlP8xZ6tOpeYoPkBvKyL.jpg,Best Movies to Watch,2026-02-17T15:30:00
Why 'Stepmom' is a Timeless Tear-Jerker You Can't Miss,"Discover why the 1998 classic 'Stepmom', starring Julia Roberts and Susan Sarandon, remains a must-watch in the realm of cinema. If you're on the hunt for movies to watch that tug at the heartstrings and raise poignant family dynamics, this film is a top recommendation. Explore this heartfelt story of unexpected bonds and emotional depth through our curated movie poster at Filmospere, your ultimate film guide. Don’t miss out on this iconic cinematic experience!",https://filmospere.com/movie/stepmom-1998,https://image.tmdb.org/t/p/original/wMPv2Yz6QDzv6YhSbaqM48Medl1.jpg,Best Movies to Watch,2026-02-17T20:30:00