Title,Description,Link,Media URL,Pinterest board,Publish Date
Discover Why 'Foundation' Is 2021's Must-Watch Sci-Fi Series!,"Looking for captivating Movies to Watch? Dive into 'Foundation', the 2021 Sci-Fi wonder rated 7.7/10! Unravel the epic saga of a Galactic Empire's destiny. Perfect for any Cinema enthusiast seeking a fresh Film Recommendation. Don't miss out on the stunning visuals and gripping storyline captured in our exclusive Movie Poster. Visit Filmospere for more cinematic gems and share your thoughts with fellow movie lovers!",https://filmospere.com/movie/foundation-2021,https://image.tmdb.org/t/p/original/tg9I5pOY4M9CKj8U0cxVBTsm5eh.jpg,Best Movies to Watch,2026-02-13T00:30:00
Discover the Buzz: Why 'New Girl' (2011) is a Must Watch!,"Looking for movies to watch? 'New Girl' (2011), with its refreshing cinema vibes, is a hidden gem with a 7.4 rating. Dive into its intriguing world even without an overview, and let your imagination take flight. Filmospere invites you to explore this movie poster and enjoy a unique film recommendation that stands out in the genre. Click to uncover why this film should be your next movie night choice!",https://filmospere.com/movie/new-girl-2011,https://image.tmdb.org/t/p/original/v5S58vtEV0fM0Chf9Pws9yfXOXT.jpg,Best Movies to Watch,2026-02-13T03:30:00
Unmasking 'Green Lantern': A Cinematic Experience Worth Revisiting,"Looking for Movies to Watch this week? Discover why 'Green Lantern' may be an underrated gem in the Cinema genre. While it originally received a lukewarm reception, its unique take on a classic superhero tale offers hidden depths worth exploring. Dive into Filmospere's Film Recommendation for an adventurous journey through intergalactic challenges. Don't miss out on the iconic Movie Poster art either—perfect for any superhero fan's collection. Join us on Filmospere for more!",https://filmospere.com/movie/green-lantern-2011,https://image.tmdb.org/t/p/original/fj21HwUprqjjwTdkKC1XZurRSpV.jpg,Best Movies to Watch,2026-02-13T11:30:00
Must Watch Sci-Fi: Dune: Part Two - Cinematic Wonders Await in 2024,"Discover why 'Dune: Part Two' ranks as a top Movies to Watch in 2024! With a gripping continuation of the legendary saga, this Cinema experience promises thrills and depth. As Film Recommendation from Filmospere, this Film's unique vision and highly rated narrative are a must for any genre enthusiast. Dive into the world of Arrakis with an upcoming Movie Poster that's set to captivate. Check out Filmospere for more!",https://filmospere.com/movie/dune-part-two-2024,https://image.tmdb.org/t/p/original/1pdfLvkbY9ohJlCjQH2CZjjYVvJ.jpg,Best Movies to Watch,2026-02-13T15:30:00
Why 'Leaving Las Vegas' is a Must-Watch Classic of the '90s,"Looking for captivating movies to watch? Dive into the emotional rollercoaster of 'Leaving Las Vegas', a 1995 cinema gem with a powerful performance by Nicolas Cage. A dark yet compelling portrayal of love and despair, it's a film recommendation for every true movie lover. Unearth striking insights and more on Filmospere. Explore this unforgettable movie poster and discover why this drama remains a standout in its genre. Join us on Filmospere for more engaging film recommendations!",https://filmospere.com/movie/leaving-las-vegas-1995,https://image.tmdb.org/t/p/original/wTrFpGe3U65kXTldIUxuM2hmOAK.jpg,Best Movies to Watch,2026-02-13T20:30:00