Title,Description,Link,Media URL,Pinterest board,Publish Date
Uncover the Flashpoint Twist: A Must-Watch Animation Adventure!,"Dive into the thrilling world of 'Justice League: The Flashpoint Paradox', a 2013 animated gem that redefines the Cinema genre with its gripping storyline! Discover why this 7.9 rated movie is a top pick on our Movies to Watch list. Explore the iconic Movie Poster and unravel the mystery behind a world where heroes are few and far between. Visit Filmospere for more Film Recommendations and join us in celebrating this masterpiece!",https://filmospere.com/movie/justice-league-the-flashpoint-paradox-2013,https://image.tmdb.org/t/p/original/hg6RYpSb3vU4i3yQDtE1YhSZNh5.jpg,Best Movies to Watch,2026-01-24T00:30:00
Must Watch: Person of Interest - A Mind-Bending 2011 Thriller,"Dive into the world of 'Person of Interest', a gripping 2011 cinema gem rated 8.1/10. This is one of those movies to watch if you're seeking an intense journey through suspense and thrills. Discover why it's an underrated film recommendation you can't miss. Explore the expertly crafted plot and dynamic characters in this movie poster and more insights on Filmospere. Unleash your inner movie-lover and join us for more film recommendations now!",https://filmospere.com/movie/person-of-interest-2011,https://image.tmdb.org/t/p/original/6FuKOyJgViZXgMDOq9djFJLWPqX.jpg,Best Movies to Watch,2026-01-24T03:30:00
Epic Cinematic Showdown: The Battle of the Five Armies You Can't Miss,"Dive into the epic finale of Middle-earth's saga with 'The Hobbit: The Battle of the Five Armies'. Witness the heart-pounding battle for control as alliances form and destinies collide. Perfect for your list of movies to watch, this 2014 blockbuster is a cinema spectacle filled with action, drama, and breathtaking visuals. Discover more exciting film recommendations and explore movie posters at Filmospere for an unforgettable movie journey!",https://filmospere.com/movie/the-hobbit-the-battle-of-the-five-armies-2014,https://image.tmdb.org/t/p/original/xT98tLqatZPQApyRmlPL12LtiWp.jpg,Best Movies to Watch,2026-01-24T11:30:00
The Thrills of Silence: Must Watch 'A Quiet Place',Discover why 'A Quiet Place' is a must on your list of Movies to Watch! This 2018 Cinema gem with a 7.4/10 rating offers a thrilling experience without relying on dialogue. Looking for a unique Film Recommendation? Dive into the suspense and silent terror that will keep you on the edge of your seat. Explore more movie insights at Filmospere where every Movie Poster tells a story. Don't miss adding this to your watchlist!,https://filmospere.com/movie/a-quiet-place-2018,https://image.tmdb.org/t/p/original/nAU74GmpUk7t5iklEp3bufwDq4n.jpg,Best Movies to Watch,2026-01-24T15:30:00
Discover the Magic of Star Trek: Discovery - A Sci-Fi Must-Watch!,"Dive into the exhilarating universe of 'Star Trek: Discovery'! This 2017 Sci-Fi cinema marvel promises thrilling adventures. Whether you're seeking Movies to Watch or crave a new Film Recommendation, this title delivers. Explore a captivating saga where no trek into the stars is ever ordinary. Check out the intriguing Movie Poster and join Filmospere for must-see insights. Immerse yourself today and find out why this gem rates a solid 7.0/10!",https://filmospere.com/movie/star-trek-discovery-2017,https://image.tmdb.org/t/p/original/xwpOHgym48Ftz7fbJq5te5xoiwu.jpg,Best Movies to Watch,2026-01-24T20:30:00